{
  "$schema": "../schema/recommendation-policy-base.schema.json",
  "schemaVersion": 1,
  "scoring": {
    "demandMatchCap": 40,
    "portfolioFitMultiplier": 42,
    "trustDivisor": 10,
    "sourcePriorityDivisor": 12,
    "authorityWeights": {
      "trusted-local": 38,
      "official-first-party": 58,
      "official-marketplace": 48,
      "official-compatible": 42,
      "trusted-community": 26,
      "unverified-community": 8
    },
    "compatibilityWeights": {
      "native": 24,
      "adaptable": 18,
      "partial": 8,
      "reference-only": -8,
      "incompatible": -30
    },
    "costPenalties": {
      "tiny": 0,
      "small": 2,
      "medium": 7,
      "large": 14
    },
    "demandSignalWeights": {
      "languages": 4,
      "packageManagers": 2,
      "frameworks": 10,
      "concerns": 4,
      "tooling": 3
    },
    "riskLevelPenalties": {
      "low": 0,
      "medium": 5,
      "high": 12
    },
    "riskFlagPenalties": {
      "hasHooks": 4,
      "hasExecScripts": 4,
      "requiresNetwork": 3
    },
    "freshness": {
      "recentDays": 45,
      "recentBoost": 6,
      "staleDays": 240,
      "stalePenalty": 6,
      "unknownPenalty": 2
    },
    "genericCapabilityPenalty": 10,
    "lowFitPenaltyThreshold": 0.35,
    "lowFitPenalty": 8,
    "weakDemandPenalty": 16,
    "outOfDomainGroupPenalty": 18,
    "coverageGainWeight": 2,
    "sourceDiversityBonus": 6,
    "overlapPenalty": 6,
    "demandTermMultipliers": {
      "actor-development": 1.25,
      "apify": 1.35,
      "backend": 0.8,
      "api-design": 0.9,
      "fullstack": 0.85,
      "database": 1.0,
      "e2e-testing": 0.85,
      "containerization": 1.1,
      "debugging": 1.1,
      "docker": 1.15,
      "duckdb": 1.15,
      "infrastructure": 1.1,
      "integration": 0.75,
      "javascript": 0.55,
      "java": 0.55,
      "go": 0.55,
      "rust": 0.55,
      "csharp": 0.55,
      "node-backend": 1.15,
      "python-backend": 1.15,
      "nextjs": 1.05,
      "supabase": 1.05,
      "orm": 1.0,
      "ai-sdk": 1.0,
      "express": 1.05,
      "fastify": 1.05,
      "nestjs": 1.05,
      "hono": 1.05,
      "fastapi": 1.05,
      "django": 1.05,
      "flask": 1.05,
      "litestar": 1.05,
      "testing": 0.8,
      "typescript": 0.55,
      "webhook": 1.25,
      "knowledge-base": 1.05,
      "documentation": 1.05,
      "research": 1.1,
      "writing": 0.9,
      "notebooks": 1.15,
      "data-science": 1.15,
      "data-engineering": 1.2,
      "media": 0.9,
      "design-assets": 0.9,
      "creative-production": 0.9,
      "cad": 1.1,
      "hardware": 1.1,
      "engineering": 1.05,
      "game-development": 1.05,
      "realtime-media": 0.95,
      "publishing": 0.9,
      "machine-learning": 1.2,
      "model-artifacts": 1.1,
      "ai": 1.15,
      "mobile": 1.05,
      "python": 0.75,
      "jupyter": 1.05,
      "asset-pipeline": 0.9,
      "godot": 1.05,
      "game-engine": 1.05,
      "latex": 0.9,
      "android": 1.05,
      "ios": 1.05,
      "cloud": 1.05,
      "aws": 1.05,
      "gcp": 1.05,
      "firebase": 1.05,
      "blockchain": 1.0,
      "web3": 1.0,
      "cryptography": 1.05,
      "pentesting": 1.1,
      "robotics": 1.15,
      "systems-engineering": 1.05,
      "deep-learning": 1.15,
      "reinforcement-learning": 1.1,
      "marketing": 0.85,
      "seo": 0.9,
      "lead-generation": 0.9,
      "content-creation": 0.85,
      "test-runner": 0.8,
      "actor-runtime": 1.0,
      "networking": 1.0,
      "business-analysis": 0.9,
      "3d-printing": 1.05,
      "fabrication": 1.0,
      "frontend-tooling": 0.9,
      "java-backend": 1.1,
      "dotnet-backend": 1.1,
      "go-backend": 1.1,
      "rust-backend": 1.1,
      "backend-framework": 1.0,
      "data-platform": 1.05,
      "design-systems": 0.95
    }
  },
  "hostDefaults": {
    "suppressedAssetIdPatterns": [
      "brand-voice",
      "crosspost",
      "article-writing"
    ],
    "suppressedCapabilityTerms": [
      "linkedin",
      "marketing",
      "copywriting",
      "social-media"
    ]
  },
  "presets": {
    "targetConcerns": {
      "delivery-core": [
        {
          "concern": "backend",
          "minimum": 6,
          "weight": 4
        },
        {
          "concern": "integration",
          "minimum": 5,
          "weight": 3
        },
        {
          "concern": "testing",
          "minimum": 5,
          "weight": 3
        },
        {
          "concern": "security",
          "minimum": 4,
          "weight": 2
        },
        {
          "concern": "infra",
          "minimum": 4,
          "weight": 2
        }
      ],
      "shared-runtime": [
        {
          "concern": "integration",
          "minimum": 8,
          "weight": 4
        },
        {
          "concern": "security",
          "minimum": 4,
          "weight": 3
        },
        {
          "concern": "infra",
          "minimum": 4,
          "weight": 2
        },
        {
          "concern": "data",
          "minimum": 3,
          "weight": 2
        }
      ]
    }
  },
  "concernKeywordMap": {
    "frontend": [
      "frontend",
      "react",
      "nextjs",
      "vue",
      "angular",
      "svelte",
      "astro",
      "ui",
      "accessibility",
      "frontend-tooling",
      "design-systems"
    ],
    "backend": [
      "backend",
      "express",
      "node-backend",
      "api",
      "api-design",
      "fullstack",
      "apify",
      "webhook",
      "python-backend",
      "fastapi",
      "django",
      "flask",
      "litestar",
      "java",
      "go",
      "rust",
      "csharp",
      "java-backend",
      "dotnet-backend",
      "go-backend",
      "rust-backend",
      "backend-framework"
    ],
    "integration": [
      "integration",
      "webhook",
      "mcp",
      "connector",
      "workflow",
      "servicebus",
      "eventhub"
    ],
    "data": [
      "database",
      "duckdb",
      "sql",
      "postgres",
      "analytics",
      "cosmos",
      "data",
      "data-engineering",
      "data-science",
      "jupyter",
      "data-platform",
      "orm"
    ],
    "security": [
      "security",
      "auth",
      "threat",
      "audit",
      "content-safety",
      "governance"
    ],
    "docs": ["doc", "readme", "instruction", "guide", "reference"],
    "testing": [
      "test",
      "testing",
      "jest",
      "playwright",
      "qa",
      "debugging",
      "e2e-testing",
      "test-runner"
    ],
    "infra": [
      "infra",
      "devops",
      "terraform",
      "docker",
      "kubernetes",
      "container",
      "azure",
      "aws",
      "gcp",
      "cloud",
      "firebase"
    ],
    "automation": [
      "automation",
      "actor",
      "actor-runtime",
      "apify",
      "scraping",
      "web-scraping",
      "crawler",
      "agent"
    ],
    "knowledge": ["documentation", "knowledge-base", "reference", "guide"],
    "research": [
      "research",
      "notebooks",
      "paper",
      "publishing",
      "writing",
      "latex"
    ],
    "media": [
      "media",
      "design-assets",
      "creative-production",
      "asset-pipeline",
      "realtime-media"
    ],
    "marketing": [
      "marketing",
      "seo",
      "lead-generation",
      "advertising",
      "content-creation"
    ],
    "security-research": [
      "cryptography",
      "pentesting",
      "blockchain",
      "web3",
      "networking"
    ],
    "robotics": ["robotics", "systems-engineering", "ros"],
    "advanced-ai": [
      "deep-learning",
      "reinforcement-learning",
      "machine-learning",
      "ai"
    ],
    "engineering": [
      "cad",
      "hardware",
      "engineering",
      "3d-printing",
      "fabrication"
    ],
    "game": ["game-development", "game-engine", "godot", "realtime-media"],
    "ai": ["model-artifacts", "ai-sdk"],
    "mobile": ["mobile", "android", "ios"]
  },
  "taskModeKeywordMap": {
    "implementation": [
      "backend",
      "frontend",
      "api",
      "service",
      "react",
      "vue",
      "typescript",
      "javascript"
    ],
    "validation": [
      "testing",
      "test",
      "playwright",
      "qa",
      "audit",
      "debugging",
      "security"
    ],
    "operations": [
      "infra",
      "devops",
      "terraform",
      "docker",
      "kubernetes",
      "deploy",
      "monitor"
    ],
    "research": [
      "research",
      "docs",
      "guide",
      "prompt",
      "architecture",
      "reference"
    ],
    "automation": [
      "workflow",
      "webhook",
      "integration",
      "mcp",
      "actor",
      "actor-runtime",
      "apify",
      "scraping",
      "web-scraping"
    ],
    "analysis": [
      "analysis",
      "research",
      "data-science",
      "notebooks",
      "analytics",
      "business-analysis"
    ],
    "design": ["media", "design-assets", "cad", "hardware", "game-development"],
    "marketing": ["marketing", "seo", "lead-generation", "content-creation"],
    "mobile": ["mobile", "android", "ios"],
    "security": [
      "security",
      "cryptography",
      "pentesting",
      "blockchain",
      "networking"
    ],
    "robotics": ["robotics", "systems-engineering", "ros"]
  },
  "domainKeywordGroups": {
    "azure": [
      "azure",
      "cosmos",
      "servicebus",
      "eventhub",
      "keyvault",
      "appconfiguration",
      "web-pubsub"
    ],
    "aws": ["aws", "lambda", "dynamodb", "s3", "cloudformation"],
    "gcp": ["gcp", "google-cloud", "bigquery", "cloud-run", "pubsub"],
    "expo": ["expo", "react-native"],
    "firebase": ["firebase", "firestore", "genkit"],
    "flutter": ["flutter", "dart"],
    "hashicorp": ["terraform", "hashicorp"],
    "power-platform": [
      "dataverse",
      "power-platform",
      "power-bi",
      "pcf",
      "copilot-studio"
    ],
    "studio-content": ["remotion", "sanity", "tinybird"],
    "data": [
      "data",
      "analytics",